{
  "candidateId": "rimeflow-yolov8n-android-litert-fp32-794e17d9a279",
  "candidateManifest": {
    "bytes": 15687,
    "path": "evidence/conversions/android-litert-candidate-manifest.json",
    "sha256": "365567e382a6edfb590ee9caae4dc290d4d320e2c2151b064761e7a7770b8ed5"
  },
  "hostGolden": {
    "comparison": {
      "artifactSha256Equal": true,
      "fixtureRawAndDecodedEqual": true,
      "goldenReportDigestEqual": true,
      "ioMetadataEqual": true,
      "manifestDigestEqual": true,
      "trackedWorktreeUnchanged": true
    },
    "goldenReport": {
      "path": "evidence/reports/litert-golden-report.json",
      "sha256": "071f418b79c0612e00bcea97aa7785cc4e90e4aeb2356884703e666c4bfb9e28",
      "summary": {
        "allFinite": true,
        "allShapesMatched": true,
        "classMismatchCount": 0,
        "deterministic": true,
        "fixtureCount": 5,
        "maximumConfidenceAbsolute": 9.530395508328127e-07,
        "maximumDecodedBboxAbsolute": 6.82200851476189e-07,
        "maximumRawAbsolute": 0.003204345703125,
        "maximumRawRelative": 4.391961097717285,
        "minimumBboxIou": 0.9999981541566957,
        "rawToleranceMismatchCount": 0
      }
    },
    "replayArtifactManifestSha256": [
      "f1f95bac2006cd02e364123ab9e7556cc331e6d20f49006c50fcebd15d0c4881",
      "f1f95bac2006cd02e364123ab9e7556cc331e6d20f49006c50fcebd15d0c4881"
    ],
    "replayArtifactSha256": [
      "794e17d9a2795084787e5125bcfada6cb501c6afc4f708e7e58e96fd8dc84be1",
      "794e17d9a2795084787e5125bcfada6cb501c6afc4f708e7e58e96fd8dc84be1"
    ],
    "rounds": 2
  },
  "publication": {
    "artifactPublished": false,
    "immutableLocation": null,
    "reason": "no tracked approved private artifact destination; public model upload is prohibited",
    "remoteParityVerified": false,
    "testedLocalArtifactRetained": true
  },
  "schema": {
    "bytes": 1278,
    "path": "evidence/schemas/android-litert-candidate-report.schema.json",
    "sha256": "0df7dca0c6cb429d32e24cab18b29d32e92fa5de5c29e9614b598bec4a290794"
  },
  "schemaVersion": 1,
  "sourceCheckpoint": {
    "bytes": 6549796,
    "releaseAssetId": 195719301,
    "releaseTag": "v8.3.0",
    "sha256": "f59b3d833e2ff32e194b5bb8e08d211dc7c5bdf144b90d2c8412c47ccfc83b36",
    "url": "https://github.com/ultralytics/assets/releases/download/v8.3.0/yolov8n.pt"
  },
  "status": {
    "androidTargetAccepted": false,
    "hostGoldenPassed": true,
    "supported": false,
    "value": "host-candidate-verified-pending-real-device"
  },
  "trackedInputState": {
    "deterministic": true,
    "files": [
      {
        "bytes": 1064,
        "path": "LICENSE",
        "sha256": "0e9cf1beb7efd7c779613bd0030ed303a5c26d73dd5e22e5a8fad4ffc2e968e0"
      },
      {
        "bytes": 12851098,
        "path": "models/yolov8n.onnx",
        "sha256": "9e7e3921595672c4b97e78f78bf5604d86ffc117773da49f142d1047109d07ad"
      },
      {
        "bytes": 2910,
        "path": "src/postprocess.rs",
        "sha256": "2a07f30ef59aa5d730cc0593adf7e69bc7351f285bdc10a2f7199f4e05d8ff4b"
      },
      {
        "bytes": 7152,
        "path": "evidence/conversions/litert-artifact-manifest.json",
        "sha256": "f1f95bac2006cd02e364123ab9e7556cc331e6d20f49006c50fcebd15d0c4881"
      },
      {
        "bytes": 9945,
        "path": "evidence/fixtures/manifest.json",
        "sha256": "430c391b9cab0c36b2bde93964e8f6afcd66b0dcb05b055d2728c47679a38acc"
      },
      {
        "bytes": 29752,
        "path": "evidence/golden/web-reference.json",
        "sha256": "114d7ab29afa5bf9b6246dfd6f1cff37ee3d4fc8212b355d2fb3ac9122f9ce68"
      },
      {
        "bytes": 20179,
        "path": "evidence/reports/litert-golden-report.json",
        "sha256": "071f418b79c0612e00bcea97aa7785cc4e90e4aeb2356884703e666c4bfb9e28"
      },
      {
        "bytes": 5303,
        "path": "evidence/reports/model-provenance.json",
        "sha256": "478b09fc38b18929e70dc00968a1d31760a3ec5844a322a5bcbc648bd5f3403c"
      },
      {
        "bytes": 11741,
        "path": "evidence/requirements/validation-requirement-test-matrix.json",
        "sha256": "eca97cd29963ceea7ba53fac5c0c882dc40264fc2b57e5ca56d12a8218547372"
      },
      {
        "bytes": 5230,
        "path": "evidence/schemas/android-litert-candidate-manifest.schema.json",
        "sha256": "3c39b021a8a0a8705d98a1cf9f89aeb7de4985ff02bbabb765f1099be19d3c4a"
      },
      {
        "bytes": 1278,
        "path": "evidence/schemas/android-litert-candidate-report.schema.json",
        "sha256": "0df7dca0c6cb429d32e24cab18b29d32e92fa5de5c29e9614b598bec4a290794"
      },
      {
        "bytes": 21838,
        "path": "evidence/scripts/android_litert_candidate.py",
        "sha256": "ff1980f269d4e9a4315964bf7c4fd787e4961256a83e41a2d639daaabcce737d"
      },
      {
        "bytes": 6192,
        "path": "evidence/scripts/export_litert_model.py",
        "sha256": "480550b54c191e008e5f3a51dbcfcd2f0e53b4c60f3e18b7b47bdd31510f64eb"
      },
      {
        "bytes": 3183,
        "path": "evidence/scripts/export_web_reference_tensors.mjs",
        "sha256": "c0da6ee41fb320dd98e58b91456725fe7f495caf828592d281fa13b0878dd7ef"
      },
      {
        "bytes": 3939,
        "path": "evidence/scripts/preprocess_contract.mjs",
        "sha256": "6ab42f34588643884762fad2497716ea324a6a207461ca6cdd125de830a2c530"
      },
      {
        "bytes": 16595,
        "path": "evidence/scripts/run_litert_replay.py",
        "sha256": "ea58877e5f94ea4f731d884ab37cb2de2d6c9d6f436517f4406e86615fab7d79"
      },
      {
        "bytes": 16494,
        "path": "evidence/scripts/validate_litert_golden.py",
        "sha256": "6e6490213f50b8e01168321c68611f23899b150bcf46cbb304aa80614475c339"
      },
      {
        "bytes": 361,
        "path": "evidence/tooling/litert-requirements.in",
        "sha256": "a312b3559442470a1091f7e13e61e45cc6a09486b2659e2cf9b39baf30abc8b7"
      },
      {
        "bytes": 8235,
        "path": "evidence/tooling/litert-requirements.lock",
        "sha256": "e2d02de988f6ca13d2a2882c9938620b25e74ebd6b66cd7daf372329174dfba2"
      },
      {
        "bytes": 16541,
        "path": "evidence/tooling/web/bun.lock",
        "sha256": "762f37b284dc99009ead59fc5deb322ca1b7920d40b113a0b1488de7de9c6c55"
      },
      {
        "bytes": 220,
        "path": "evidence/tooling/web/package.json",
        "sha256": "6e614de4e2bfe30b7fbcd7842cdee1d9dccae461733a5b0799f08cb778a4a255"
      }
    ]
  }
}
